status,section,docId,in_en,in_vi,in_ja,en_title,vi_title,ja_title
ORPHAN,file-storage-high-performance,"su-dung-file-storage-high-performance-tren-kubernetes-k8s-cluster",N,N,Y,"","","Kubernetes (K8S Cluster) での File Storage – High Performance の利用"
ORPHAN,file-storage-high-performance,"using-file-storage-high-performance-on-kubernetes-k8s-cluster",Y,N,N,"Use on Kubernetes cluster","",""
ORPHAN,file-storage-high-performance,"vietnam-region",Y,N,N,"Vietnam region","",""
MATCHED,file-storage-high-performance,"vn-su-dung-file-storage-high-performance-tren-baremetal-gpu-server",Y,Y,Y,"Vn Su Dung File Storage High Performance Tren Baremetal Gpu Server","Sử dụng File Storage - High Performance trên Baremetal (GPU Server)","Baremetal (GPU Server) での File Storage – High Performance の利用"
MATCHED,file-storage-high-performance,"vn-using-file-storage-high-performance-on-baremetal-gpu-server",Y,Y,Y,"Create mount point (Vietnam)","Create mount point (Vietnam)","Create mount point (Vietnam)"
MATCHED,fortigate-fpt-ngfw,"FAQ",Y,Y,Y,"FAQ","Câu hỏi thường gặp","よくある質問"
MATCHED,fortigate-fpt-ngfw,"cau-hinh-network-interfaces",Y,Y,Y,"Configure network interfaces","Cấu hình Network Interfaces","Network Interfaces の設定"
MATCHED,fortigate-fpt-ngfw,"cau-hinh-static-routes",Y,Y,Y,"Configure static routes","Cấu hình Static Routes","Static Routes の設定"
MATCHED,fortigate-fpt-ngfw,"feature-visibility",Y,Y,Y,"Feature visibility","Tắt bật các Feature có trên Fortigate NGFW. System > Feature Visibility","Fortigate NGFW の機能の有効・無効化。System > Feature Visibility"
MATCHED,fortigate-fpt-ngfw,"fortigate-fpt-ngfw",Y,Y,Y,"Fortigate – FPT NGFW","Fortigate – FPT NGFW","Fortigate – FPT NGFW"
MATCHED,fortigate-fpt-ngfw,"hien-thi-logs-traffic",Y,Y,Y,"View traffic logs","Hiển thị Logs Traffic","Logs Traffic の表示"
MATCHED,fortigate-fpt-ngfw,"quan-ly-system-user-user-profile",Y,Y,Y,"Manage system users and user profiles","Quản Lý System User – User Profile","System User – User Profile の管理"
MATCHED,fortigate-fpt-ngfw,"tao-firewall-policy",Y,Y,Y,"Create a firewall policy","Tạo Firewall Policy","Firewall Policy の作成"
MATCHED,fortigate-fpt-ngfw,"tao-security-profile",Y,Y,Y,"Create security profiles","Tạo Security Profile","Security Profile の作成"
MATCHED,fortigate-fpt-ngfw,"truy-cap-giao-dien-quan-tri",Y,Y,Y,"Access the admin interface","Truy cập giao diện quản trị","管理インターフェースへのアクセス"
MATCHED,fortigate-fpt-ngfw,"xoa-firewall-policy",Y,Y,Y,"Delete a firewall policy","Xóa Firewall Policy","Firewall Policy の削除"
MATCHED,fpt-api-gateway,"fpt-api-gateway",Y,Y,Y,"FPT API Gateway","FPT API Gateway","FPT API Gateway"
MATCHED,fpt-api-gateway,"initial-setup",Y,Y,Y,"Initial setup","Thiết lập ban đầu","初期設定"
MATCHED,fpt-api-gateway,"tao-api-gateway",Y,Y,Y,"Create an API Gateway","Tạo API Gateway","API Gatewayの作成"
MATCHED,fpt-api-gateway,"xem-thong-tin-api-gateway",Y,Y,Y,"View API Gateway details","Xem thông tin API Gateway","API Gatewayの詳細確認"
MATCHED,fpt-api-gateway,"xoa-api-gateway",Y,Y,Y,"Delete an API Gateway","Xóa API Gateway","API Gatewayの削除"
MATCHED,fpt-api-management,"analytics",Y,Y,Y,"Analytics","Analytics","Analytics"
MATCHED,fpt-api-management,"consumer-api-usage-guide",Y,Y,Y,"API Consumer usage guide","Hướng dẫn sử dụng cho API Consumer","API Consumer 向け利用ガイド"
PARTIAL,fpt-api-management,"declaring-information",Y,N,Y,"Declaring information on ApiManager Application","","ApiManager Application での情報設定"
MATCHED,fpt-api-management,"fpt-api-management",Y,Y,Y,"FPT API Management","FPT API Management","Fpt Api Management"
MATCHED,fpt-api-management,"initial-setup",Y,Y,Y,"Initial setup","Thiết lập ban đầu","初期設定"
ORPHAN,fpt-api-management,"khai-bao-thong-tin-tren-apimanager-application",N,Y,N,"","Khai báo thông tin trên ApiManager Application",""
MATCHED,fpt-api-management,"manage-rest-apis",Y,Y,Y,"Managing REST APIs","Quản lý REST APIs","Managing REST APIs"
MATCHED,fpt-api-management,"managing-consumers",Y,Y,Y,"Managing Consumers","Quản lý Consumers","Consumer の管理"
MATCHED,fpt-api-management,"managing-products",Y,Y,Y,"Managing Products","Quản lý Products","Product の管理"
MATCHED,fpt-api-management,"managing-sites",Y,Y,Y,"Managing Sites","Quản lý API Site","API Site の管理"
MATCHED,fpt-api-management,"quick-starts",Y,Y,Y,"Quick starts","Hướng dẫn nhanh (Quick Starts)","クイックスタート"
MATCHED,fpt-api-management,"registering-on-fpt-portal",Y,Y,Y,"Register API Management on FPT Portal","Đăng ký dịch vụ API Management trên FPT Portal","FPT Portal での API Management サービス登録"
MATCHED,fpt-app-catalogs,"add-cluster-to-app-catalogs-management",Y,Y,Y,"Add Cluster To App Catalogs Management","Kết nối cluster tới App Catalog Management","クラスターを App Catalogs Management に追加する"
MATCHED,fpt-app-catalogs,"app-catalogs",Y,Y,Y,"App Catalogs","FPT App Catalogs","App Catalogs"
MATCHED,fpt-app-catalogs,"change-applications-configuration",Y,Y,Y,"Change Applications Configuration","Thay đổi cấu hình của applications","アプリケーション設定を変更する"
MATCHED,fpt-app-catalogs,"create-a-new-fpt-app-catalogs",Y,Y,Y,"Create A New Fpt App Catalogs","Tạo mới App Catalog","新しい App Catalog を作成する"
MATCHED,fpt-app-catalogs,"delete-an-app-catalogs-mangement",Y,Y,Y,"Delete An App Catalogs Mangement","Xóa App Catalog Management","App Catalog Management を削除する"
MATCHED,fpt-app-catalogs,"deploy-app-catalogs-to-cluster",Y,Y,Y,"Deploy App Catalogs To Cluster","Deploy App Catalog tới cluster","クラスターへ App Catalog をデプロイする"
MATCHED,fpt-app-catalogs,"filter-deployed-appplications-by-cluster",Y,Y,Y,"Filter Deployed Appplications By Cluster","Filter apps đã deploy theo cluster","クラスター別にデプロイ済みアプリをフィルタリングする"
ORPHAN,fpt-app-catalogs,"fpt-app-catalogs",Y,N,N,"FPT App Catalogs","",""
MATCHED,fpt-app-catalogs,"initial-setup",Y,Y,Y,"Initial Setup","Thiết lập ban đầu","初期セットアップ"
PARTIAL,fpt-app-catalogs,"manage-app-catalogs",Y,N,Y,"Manage App Catalogs","","App Catalogs の管理"
PARTIAL,fpt-app-catalogs,"manage-deployed-applications",Y,N,Y,"Manage Deployed Applications","","デプロイ済みアプリケーションの管理"
ORPHAN,fpt-app-catalogs,"quan-ly-app-catalogs",N,Y,N,"","Quản lý App Catalogs",""
ORPHAN,fpt-app-catalogs,"quan-ly-applications-da-duoc-deploy",N,Y,N,"","Quản lý applications đã được deploy",""
MATCHED,fpt-app-catalogs,"rollback-an-application-to-the-old-configuration",Y,Y,Y,"Rollback An Application To The Old Configuration","Rollback app về cấu hình cũ","アプリケーションを旧設定にロールバックする"
MATCHED,fpt-app-catalogs,"search-app-catalogs-from-a-repository",Y,Y,Y,"Search App Catalogs From A Repository","Tìm kiếm App Catalog trong repository","リポジトリから App Catalog を検索する"
MATCHED,fpt-app-catalogs,"uninstall-applications",Y,Y,Y,"Uninstall Applications","Uninstall applications","アプリケーションをアンインストールする"
MATCHED,fpt-app-catalogs,"upgrade-applications-to-the-latest-version",Y,Y,Y,"Upgrade Applications To The Latest Version","Upgrade applications tới version mới nhất","アプリケーションを最新バージョンにアップグレードする"
MATCHED,fpt-app-catalogs,"view-app-catalog-details",Y,Y,Y,"View App Catalog Details","Xem thông tin chi tiết App Catalog","App Catalog の詳細を表示する"
MATCHED,fpt-app-catalogs,"view-deployed-applications-details",Y,Y,Y,"View Deployed Applications Details","Xem chi tiết app đã deploy","デプロイ済みアプリケーションの詳細を表示する"
MATCHED,fpt-appsec,"aspm_v1.2.1",Y,Y,Y,"Release note: Issue life cycle management (v1.2.1)","1. Mô tả","1. 概要"
MATCHED,fpt-appsec,"aspm_v1.3.0",Y,Y,Y,"Release note: Schedule management (v1.3.0)","1. Mô tả","1. 概要"
MATCHED,fpt-appsec,"cai-dat-team",Y,Y,Y,"Team settings","Cài đặt Team","チーム設定"
MATCHED,fpt-appsec,"chinh-sua-thong-tin-org",Y,Y,Y,"Edit organization information","Chỉnh sửa thông tin tổ chức","組織情報の編集"
MATCHED,fpt-appsec,"cicd-guideline",Y,Y,Y,"DevOps pipeline integration","Guideline: Tích hợp Scanning API của FSP Core Service vào CI/CD Pipelines","ガイドライン: FSP Core ServiceのScanning APIをCI/CDパイプラインに統合する"
MATCHED,fpt-appsec,"create-schedule",Y,Y,Y,"Create a schedule","Hướng dẫn tạo schedule","スケジュール作成ガイド"
MATCHED,fpt-appsec,"detail-dasboard",Y,Y,Y,"Dashboard","Detail Dasboard","ダッシュボード"
MATCHED,fpt-appsec,"fpt-appsec",Y,Y,Y,"FPT AppSec","Fpt Appsec","FPT AppSec"
MATCHED,fpt-appsec,"gioi-thieu-Organization",Y,Y,Y,"Organization management","Organization Management - Quản lý Organization","Organization Management - 組織管理"
MATCHED,fpt-appsec,"guide-asset-by-team",Y,Y,Y,"Dashboard chart: Assets by team","Hướng dẫn đọc biểu đồ Asset by team","Asset by teamグラフの読み方"
MATCHED,fpt-appsec,"guide-change-status-issue-detail",Y,Y,Y,"Manage issue status in the Issue detail screen","Hướng dẫn quản lý trạng thái issue tại màn Issue detail","Issue detail画面でのIssueステータス管理ガイド"
MATCHED,fpt-appsec,"guide-change-status-issue-list",Y,Y,Y,"Change issue status in the Issue list","Hướng dẫn thay đổi trạng thái issue tại màn Issue list","Issue list画面でのIssueステータス変更ガイド"
MATCHED,fpt-appsec,"guide-dashboard-overview",Y,Y,Y,"Dashboard metrics: Organization overview","Hướng dẫn đọc các số liệu Dashboard - Organization overview","ダッシュボードの指標の読み方 - Organization overview"
MATCHED,fpt-appsec,"guide-fcr",Y,Y,Y,"FPT Container Registry integration","5. Vô hiệu hoá tích hợp FPT Container Registry","5. FPT Container Registry連携の無効化"
MATCHED,fpt-appsec,"guide-github",Y,Y,Y,"GitHub Personal/Enterprise Cloud integration","Chỉ Org Admin có quyền chỉnh sửa tích hợp GitHub","GitHub連携の編集はOrg Adminのみ可能です"
MATCHED,fpt-appsec,"guide-gitlab",Y,Y,Y,"GitLab Cloud integration","Chỉ Org Admin và Team Manager có quyền chỉnh sửa tích hợp GitLab","GitLab連携の編集はOrg AdminとTeam Managerのみ可能です"
MATCHED,fpt-appsec,"guide-gitlabserver",Y,Y,Y,"GitLab Server integration","Chỉ Org Admin và Team Manager có quyền chỉnh sửa tích hợp GitLab Server","GitLab Server連携の編集はOrg AdminとTeam Managerのみ可能です"
MATCHED,fpt-appsec,"guide-harbor",Y,Y,Y,"Harbor integration","1. Tạo Robot Account - Harbor","1. Robot Accountの作成 - Harbor"
MATCHED,fpt-appsec,"guide-integration",Y,Y,Y,"Integration management","Integration Management - Quản lý tích hợp","Integration Management - 連携管理"
MATCHED,fpt-appsec,"guide-issue-by-team",Y,Y,Y,"Dashboard chart: Issues by team","Hướng dẫn đọc biểu đồ Issue by team","Issue by teamグラフの読み方"
MATCHED,fpt-appsec,"guide-workspace",Y,Y,Y,"Workspace management","Workspace Management - Quản lý Asset và Issue","Workspace Management - AssetおよびIssue管理"
MATCHED,fpt-appsec,"initial-setup",Y,Y,Y,"Initial setup","Thiết lập ban đầu","初期設定"
MATCHED,fpt-appsec,"quan-ly-mem-team",Y,Y,Y,"Manage team members","Quản lý Members","メンバー管理（チーム）"
MATCHED,fpt-appsec,"quan-ly-member",Y,Y,Y,"Manage members","Quản lý member","メンバー管理"
MATCHED,fpt-appsec,"quan-ly-role",Y,Y,Y,"Manage roles","Quản lý Roles","ロール管理"
MATCHED,fpt-appsec,"quan-ly-team",Y,Y,Y,"Team management","Team Management - Quản lý Team","Team Management - チーム管理"
MATCHED,fpt-appsec,"quan-ly-teams-org",Y,Y,Y,"Manage teams","Quản lý Teams","チーム管理"
MATCHED,fpt-appsec,"schedule-delete",Y,Y,Y,"Delete a schedule","Hướng dẫn xóa schedule","スケジュール削除ガイド"
MATCHED,fpt-appsec,"schedule-detail",Y,Y,Y,"View schedule list and details","Hướng dẫn xem danh sách & chi tiết schedule","スケジュール一覧と詳細の表示ガイド"
MATCHED,fpt-appsec,"schedule-edit",Y,Y,Y,"Edit a schedule","Hướng dẫn chỉnh sửa schedule","スケジュール編集ガイド"
MATCHED,fpt-appsec,"workspace-crasset",Y,Y,Y,"Container Registry asset operations","Hướng dẫn thực hiện các thao tác cơ bản với Container Registry asset (image)","Container Registry asset（image）の基本操作ガイド"
MATCHED,fpt-appsec,"workspace-scmasset",Y,Y,Y,"Source code management asset operations","2. Xem thông tin tổng quan của Assets","2. Assetの概要情報の確認"
MATCHED,fpt-argocd,"Change-password",Y,Y,Y,"Change Password","Change Password","Change Password"
MATCHED,fpt-argocd,"Configure-Build-Options-for-Kustomize",Y,Y,Y,"Configure Build Options For Kustomize","Configure Build Options For Kustomize","Configure Build Options For Kustomize"
MATCHED,fpt-argocd,"Configure-RBAC-policy",Y,Y,Y,"Configure Rbac Policy","Configure Rbac Policy","Configure Rbac Policy"
MATCHED,fpt-argocd,"Connect-Kubernetes-Cluster-to-ArgoCD-Instance",Y,Y,Y,"Connect Kubernetes Cluster To Argocd Instance","Connect Kubernetes Cluster To Argocd Instance","Connect Kubernetes Cluster To Argocd Instance"
MATCHED,fpt-argocd,"Create-new-account-on-FPT-Cloud-Portal",Y,Y,Y,"Create New Account On Fpt Cloud Portal","Create New Account On Fpt Cloud Portal","Create New Account On Fpt Cloud Portal"
MATCHED,fpt-argocd,"Create-new-webhook-secret",Y,Y,Y,"Create New Webhook Secret","Create New Webhook Secret","Create New Webhook Secret"
ORPHAN,fpt-argocd,"Demo",Y,N,N,"Demo","",""
MATCHED,fpt-argocd,"Edit-capabilities",Y,Y,Y,"Edit Capabilities","Edit Capabilities","Edit Capabilities"
ORPHAN,fpt-argocd,"Edit-webhook-secret",Y,N,N,"Edit Webhook Secret","",""
MATCHED,fpt-argocd,"Getting-Started",Y,Y,Y,"Getting Started","Getting Started","Getting Started"
MATCHED,fpt-argocd,"Initial-setup",Y,Y,Y,"Initial Setup","Thiết lập ban đầu","Initial Setup"
MATCHED,fpt-argocd,"Instructions-for-configuring-ArgoCD-cluster-to-deploy-applications-with-manifest",Y,Y,Y,"Instructions For Configuring Argocd Cluster To Deploy Applications With Manifest","Instructions For Configuring Argocd Cluster To Deploy Applications With Manifest","Instructions For Configuring Argocd Cluster To Deploy Applications With Manifest"
MATCHED,fpt-argocd,"Instructions-for-login-to-ArgoCD",Y,Y,Y,"Instructions For Login To Argocd","Instructions For Login To Argocd","Instructions For Login To Argocd"
ORPHAN,fpt-argocd,"Managing-Account-on-ArgoCD",Y,N,N,"Managing Account On Argocd","",""
MATCHED,fpt-argocd,"Upgrading-argocd-version",Y,Y,Y,"Upgrading Argocd Version","Upgrading Argocd Version","Upgrading Argocd Version"
MATCHED,fpt-argocd,"View-informations-ArgoCD",Y,Y,Y,"View Informations Argocd","View Informations Argocd","View Informations Argocd"
MATCHED,fpt-argocd,"Webhook-configuration",Y,Y,Y,"Webhook Configuration","Webhook Configuration","Webhook Configuration"
MATCHED,fpt-argocd,"add-cluster-to-argocd",Y,Y,Y,"Connect a Kubernetes cluster to ArgoCD","Kết nối cluster Kubernetes tới ArgoCD","Kubernetes clusterをArgoCDに接続します"
MATCHED,fpt-argocd,"add-webhook-secret",Y,Y,Y,"Add a new webhook secret","Tạo mới webhook secret","webhook secretを新規追加する"
PARTIAL,fpt-argocd,"cau-hinh-channel-de-thuc-hien-gui-thong-bao",Y,N,Y,"Cau Hinh Channel De Thuc Hien Gui Thong Bao","","通知チャンネルの設定"
ORPHAN,fpt-argocd,"cau-hinh-image-updater",N,Y,N,"","Cấu hình Image Updater",""
ORPHAN,fpt-argocd,"cau-hinh-notifications",N,Y,N,"","Cấu hình notifications",""
PARTIAL,fpt-argocd,"cau-hinh-oidc-config",Y,N,Y,"Cau Hinh Oidc Config","","OIDC configの設定"
ORPHAN,fpt-argocd,"cau-hinh-oidc-phuc-vu-sso-config",N,Y,N,"","Cấu hình OIDC cho SSO",""
ORPHAN,fpt-argocd,"cau-hinh-webhook",N,Y,N,"","Cấu hình webhook",""
MATCHED,fpt-argocd,"check-service-package-info",Y,Y,Y,"Check service package information","Kiểm tra thông tin gói dịch vụ","サービスパッケージ情報の確認"
PARTIAL,fpt-argocd,"cho-phep-enable-applications-set",Y,N,Y,"Enable ApplicationSet","","ApplicationSetのenable"
MATCHED,fpt-argocd,"configure-build-options-kustomize",Y,Y,Y,"Configure build options for Kustomize","Cấu hình build options cho Kustomize","KustomizeのBuild optionsの設定"
PARTIAL,fpt-argocd,"configure-image-updater",Y,N,Y,"Configure Image Updater","","Image Updaterの設定"
MATCHED,fpt-argocd,"configure-log-level",Y,Y,Y,"Configure log level","Cấu hình log level","ログレベルの設定"
PARTIAL,fpt-argocd,"configure-notification-channels",Y,Y,N,"Configure notification channels","Cấu hình channel để thực hiện gửi thông báo",""
MATCHED,fpt-argocd,"configure-notifications",Y,Y,Y,"Configure notifications","Configure Notifications","Notificationsの設定"
PARTIAL,fpt-argocd,"configure-oidc-config",Y,Y,N,"Configure OIDC","Cấu hình OIDC config",""
PARTIAL,fpt-argocd,"configure-oidc-sso",Y,N,Y,"Configure OIDC SSO","","SSO用のOIDC設定"
MATCHED,fpt-argocd,"configure-rbac",Y,Y,Y,"Configure RBAC policy","Cấu hình RBAC policy","RBAC policyの設定"
MATCHED,fpt-argocd,"configure-timereconcile",Y,Y,Y,"Configure TimeReconcile","Cấu hình TimeReconcile","TimeReconcileの設定"
PARTIAL,fpt-argocd,"configure-webhook",Y,N,Y,"Configure webhook","","Webhookの設定"
PARTIAL,fpt-argocd,"configure-webhook-with-secret",Y,Y,N,"Configure webhook with secret","Thực hiện cấu hình Webhook với webhook secret đã được tạo",""
MATCHED,fpt-argocd,"configure-whitelist-ip",Y,Y,Y,"Configure IP whitelist","Cấu hình whitelist IP","IPホワイトリストの設定"
MATCHED,fpt-argocd,"create-account",Y,Y,Y,"Create a new account on the Portal","Tạo mới tài khoản trên Portal","Portalで新しいアカウントを作成する"
MATCHED,fpt-argocd,"create-fpt-argocd",Y,Y,Y,"Create a new FPT ArgoCD instance","Tạo mới FPT ArgoCD instance","FPT ArgoCD instanceの新規作成"
PARTIAL,fpt-argocd,"delete-oidc-config",Y,Y,N,"Delete OIDC configuration","Xóa cấu hình OIDC",""
PARTIAL,fpt-argocd,"delete-oidc-da-cau-hinh",Y,N,Y,"Delete Oidc Da Cau Hinh","","OIDC configの削除"
MATCHED,fpt-argocd,"delete-webhook-secret",Y,Y,Y,"Delete a webhook secret","Xóa webhook secret","Webhook secretの削除"
MATCHED,fpt-argocd,"demo",Y,Y,Y,"Demo","Demo","Demo"
PARTIAL,fpt-argocd,"edit-webhook-secret",N,Y,Y,"","Cập nhật webhook secret","Webhook secretの編集"
PARTIAL,fpt-argocd,"enable-applications-set",Y,Y,N,"Enable Applications Set","Enable ApplicationSet",""
MATCHED,fpt-argocd,"enable-disable-account",Y,Y,Y,"Enable/disable account","Enable/disable tài khoản","アカウントのenable/disable"
MATCHED,fpt-argocd,"enable-disable-admin-user",Y,Y,Y,"Enable/disable admin user","Enable/disable tài khoản admin","Adminアカウントのenable/disable"
MATCHED,fpt-argocd,"enable-disable-anonymous-user",Y,Y,Y,"Enable/disable anonymous user","Enable/disable anonymous user","Anonymous userのenable/disable"
PARTIAL,fpt-argocd,"enable-disable-chuc-nang-cau-hinh-oidc",Y,N,Y,"Enable/disable OIDC","","OIDCのenable/disable"
MATCHED,fpt-argocd,"enable-disable-images-updater",Y,Y,Y,"Enable/disable ArgoCD Image Updater","Enable/disable ArgoCD Image Updater","ArgoCD Image Updaterのenable/disable"
PARTIAL,fpt-argocd,"enable-disable-notificaions",Y,N,Y,"Enable/disable notifications","","Notificationsのenable/disable"
ORPHAN,fpt-argocd,"enable-disable-notifications",N,Y,N,"","Enable/disable notifications",""
ORPHAN,fpt-argocd,"enable-disable-oidc",N,Y,N,"","Enable/disable OIDC",""
PARTIAL,fpt-argocd,"fpt-argocd",Y,Y,N,"FPT ArgoCD","FPT ArgoCD",""
MATCHED,fpt-argocd,"huong-dan-cau-hinh-argocd-cluster-de-deploy-ung-dung-voi-manifes",Y,Y,Y,"Deploy applications with manifest","Hướng dẫn cấu hình ArgoCD cluster để deploy ứng dụng với manifes","manifestを使用してアプリケーションをデプロイする"
MATCHED,fpt-argocd,"huong-dan-cau-hinh-notifications-de-nhan-thong-bao",Y,Y,Y,"Configure notifications to receive alerts","Hướng dẫn cấu hình notifications để nhận thông báo khi ứng dụng thay đổi","通知を受け取るためにNotificationsを設定する"
MATCHED,fpt-argocd,"huong-dan-dang-nhap-vao-argocd",Y,Y,Y,"Huong Dan Dang Nhap Vao Argocd","Hướng dẫn đăng nhập vào ArgoCD","Huong Dan Dang Nhap Vao Argocd"
MATCHED,fpt-argocd,"huong-dan-deploy-applications-qua-argocd-cli",Y,Y,Y,"Deploy applications via ArgoCD CLI","Hướng dẫn deploy applications qua argocd cli","ArgoCD CLIでアプリケーションをデプロイする"
MATCHED,fpt-argocd,"huong-dan-deploy-applications-qua-helm-chart-repo",Y,Y,Y,"Deploy applications via Helm chart repository","Hướng dẫn deploy applications qua helm chart repo","Helmチャートリポジトリを使用してアプリケーションをデプロイする"
MATCHED,fpt-argocd,"huong-dan-deploy-mot-appliations-voi-kustomize-su-dung-build-options",Y,Y,Y,"Deploy an application with Kustomize using build options","Hướng dẫn deploy một applications với kustomize sử dụng build options","Kustomizeとビルドオプションを使用してアプリケーションをデプロイする"
MATCHED,fpt-argocd,"huong-dan-su-dung-applicationset-de-deploy",Y,Y,Y,"Deploy applications using ApplicationSet","Hướng dẫn sử dụng applicationset để deploy","ApplicationSetを使用してアプリケーションをデプロイする"
MATCHED,fpt-argocd,"huong-dan-tich-hop-argocd-images-updater",Y,Y,Y,"Integrate ArgoCD Image Updater","Hướng dẫn tích hợp Argo CD Images Updater","ArgoCD Image Updaterを統合する"
MATCHED,fpt-argocd,"huong-dan-tich-hop-oidc-de-quan-ly-account",Y,Y,Y,"Integrate OIDC for account management","Hướng dẫn tích hợp OIDC để quản lý account trên ArgoCD","アカウント管理のためにOIDCを統合する"
MATCHED,fpt-argocd,"initial-setup",Y,Y,Y,"Initial setup","Initial Setup","初期設定"
PARTIAL,fpt-argocd,"manage-accounts",Y,N,Y,"Manage accounts on ArgoCD","","ArgoCD上のアカウント管理"
MATCHED,fpt-argocd,"manage-admin-account",Y,Y,Y,"Manage the admin account","Quản lý tài khoản admin","Adminアカウントの管理"
MATCHED,fpt-argocd,"manage-admin-account-enable-disable-anonymous-user",Y,Y,Y,"Manage anonymous user access","Quản lý admin và anonymous user","AdminとAnonymous userの管理"
MATCHED,fpt-argocd,"manage-container-registry",Y,Y,Y,"Manage container registry","Quản lý container registry","Container registryの管理"
MATCHED,fpt-argocd,"manage-registry-secrets",Y,Y,Y,"Manage registry secrets","Quản lý registry secret","Registry secretの管理"
MATCHED,fpt-argocd,"manage-secrets",Y,Y,Y,"Manage secrets","Quản lý secret","Secretの管理"
ORPHAN,fpt-argocd,"quan-ly-account-tren-argocd",N,Y,N,"","Quản lý tài khoản trên ArgoCD",""
PARTIAL,fpt-argocd,"thuc-hien-cau-hinh-webhook-voi-webhook-secret-da-duoc-tao",Y,N,Y,"Thuc Hien Cau Hinh Webhook Voi Webhook Secret Da Duoc Tao","","Webhook secretを使用したWebhookの設定"
MATCHED,fpt-argocd,"update-admin-password",Y,Y,Y,"Update admin password","Cập nhật mật khẩu admin","Adminパスワードの更新"
PARTIAL,fpt-argocd,"update-cau-hinh-oidc",Y,N,Y,"Update Cau Hinh Oidc","","OIDC configの更新"
PARTIAL,fpt-argocd,"update-oidc-config",Y,Y,N,"Update OIDC configuration","Cập nhật cấu hình OIDC",""
MATCHED,fpt-argocd,"upgrade-service-package",Y,Y,Y,"Upgrade service package","Nâng gói dịch vụ","サービスパッケージのアップグレード"
MATCHED,fpt-argocd,"view-argocd-detail",Y,Y,Y,"View ArgoCD instance details","Xem thông tin chi tiết và đăng nhập ArgoCD","ArgoCD インスタンスの詳細を確認する"
MATCHED,fpt-autoscale,"doi-ten-profile",Y,Y,Y,"Rename Profile","Đổi tên Profile","Profileの名前変更"
PARTIAL,fpt-autoscale,"fpt-autoscale",Y,Y,N,"FPT Autoscale","FPT Autoscale",""
MATCHED,fpt-autoscale,"giam-sat-group",Y,Y,Y,"Monitor Group","Giám sát Group","Groupの監視"
MATCHED,fpt-autoscale,"khoi-tao-group",Y,Y,Y,"Create Group","Khởi tạo Group","Groupの作成"
MATCHED,fpt-autoscale,"khoi-tao-policy",Y,Y,Y,"Create Policy","Khởi tạo Policy","Policyの作成"
MATCHED,fpt-autoscale,"khoi-tao-profile",Y,Y,Y,"Create Profile","Khởi tạo Profile","Profileの作成"
MATCHED,fpt-autoscale,"quan-ly-group",Y,Y,Y,"Manage Group","Quản lý Group","Groupの管理"
MATCHED,fpt-autoscale,"quan-ly-policy",Y,Y,Y,"Manage Policy","Quản lý Policy","Policyの管理"
MATCHED,fpt-autoscale,"quan-ly-profile",Y,Y,Y,"Manage Profile","Quản lý Profile","Profileの管理"
MATCHED,fpt-autoscale,"scale-thu-cong",Y,Y,Y,"Manual Scale","Scale thủ công","手動スケール"
MATCHED,fpt-autoscale,"scale-tu-dong-theo-lich-trinh",Y,Y,Y,"Scheduled Automatic Scale","Scale tự động theo lịch trình","スケジュールによる自動スケール"
MATCHED,fpt-autoscale,"thay-doi-profile-cho-group",Y,Y,Y,"Change Profile for Group","Thay đổi Profile cho Group","GroupのProfileを変更する"
MATCHED,fpt-autoscale,"xoa-group",Y,Y,Y,"Delete Group","Xóa Group","Groupの削除"
MATCHED,fpt-autoscale,"xoa-policy",Y,Y,Y,"Delete Policy","Xóa Policy","Policyの削除"
MATCHED,fpt-autoscale,"xoa-profile",Y,Y,Y,"Delete Profile","Xóa Profile","Profileの削除"
ORPHAN,fpt-backup-as-a-service,"Chi tiết dịch vụ",N,Y,N,"","Chi Tiết Dịch Vụ",""
